post_id,subreddit,created_utc,selftext,post_url,post_title,link_flair_text,score,num_comments,upvote_ratio,post_author
kuic2y,Periods,1610298624.0,,https://i.redd.it/qjk1xdc1fja61.jpg,"This is why female serial killers never get caught, we were all taught how to remove blood from clothing at like 12 😂😭",Fluff,913,58,0.98,rybabyyy
j4x1y3,Periods,1601808602.0,,https://i.redd.it/o0l604nu52r51.jpg,Literally me 2 days ago (1 day before period),Rants n Raves,915,29,1.0,None
n3bjrf,Periods,1619977114.0,,https://i.redd.it/6bd90206uqw61.jpg,Me on my period right now😭😭😭,Fluff,904,9,1.0,None
fjlafe,Periods,1584366794.0,,https://i.redd.it/1birg1kei1n41.jpg,This. How do people exercise on their period? I’m in agony and I hibernate for 3 - 4 days.,,902,37,0.99,None
ia85km,Periods,1597501288.0,,https://i.redd.it/s4jey7e2m4h51.jpg,Relatable AF,Discussion,891,7,0.99,FancySocks1989
lsqk5m,Periods,1614316315.0,,https://i.redd.it/rpjq8kap9rj61.jpg,"Mine decided to start a day early....while I was at work, and I had no pads or tampons with me",Fluff,886,29,1.0,ArtisticSoul2019
i73wqw,Periods,1597062536.0,,https://i.redd.it/grarlyvc56g51.jpg,Genetics,Rants n Raves,868,7,1.0,t-senpie
k3zv4j,Periods,1606755785.0,,https://i.redd.it/3i8r0r6dse261.jpg,Don’t let anyone tell you otherwise,Fluff,868,27,0.99,honeyysuckle
c576cu,Healthyhooha,1561462316.0,,https://i.redd.it/my64i5jlnh631.jpg,A whole uterus in the palm of her hand (NSFW),,862,66,0.99,None
seacyw,Periods,1643321943.0,,https://i.redd.it/27h8w7ob2be81.jpg,One week,Fluff,854,20,1.0,jesiceez
10zutxs,Healthyhooha,1676141468.0,"Hello healthyhooha community.

A few recent events have transpired here that have made it obvious we needed to post a reminder:

We are an inclusive community for individuals with vaginas.

Trans-exclusive/transphobic comments will not be tolerated and will result in a swift, permanent ban. Please continue to report these types of comments. The world is a hateful enough place; we won't be standing for it here.

That said, I am actively seeking some solid, research-based information on how to properly care for neovaginas to have available to users in the sidebar, as the care is a little bit different.

Be kind to one another.

<3",https://www.reddit.com/r/Healthyhooha/comments/10zutxs/terfs_back_off/,TERFs Back Off,,850,42,0.89,peachikeene
sorhvn,Periods,1644450141.0,,https://v.redd.it/pngcmj819wg81,I don’t think I’ve ever laughed so hard…,Fluff,839,26,1.0,Effective-Rub3269
mbax00,Periods,1616492028.0,,https://i.redd.it/wqkla7n7zqo61.jpg,Why we have periods...,Fluff,841,17,0.99,baharhabibi
hshnl3,Periods,1594931176.0,,https://i.redd.it/x436m2dq3ab51.jpg,Me whenever i get my period,Fluff,832,10,0.99,user_han001
14v1sim,Healthyhooha,1688917507.0,"1. Dirty “Joy Stick” 🍆 That’s what y’all may call it but just like the one on your shared PlayStation remote it’s packed with bacteria. So wash your penis properly.

2. Too much sperm in the vagina. This a breeding haven for bacteria, so do us both a favor and pull out sometimes.

3. Dirty Balls. It’s just as bad as a dirty 🍆  f it’s itching it’s not because it’s a guy thing, it’s because you have YEAST 🧀. 

4. Too much pubic hair. You want women to shave and keep it trim, but your sweaty 🥚🥚 is covered in hair. Hair traps and carry the bacteria from not only your 🥚🥚 but your anus. 

5. Draws are too small. Wear your size and then you won’t be scratching so much. Small jockey = Tight + sweat = Bacteria, simple math.

6. Community Doggy. Mixing the fluids from different women throws off a woman’s pH.

7. Being too much a man to see a Doctor. WebMD cannot solve everything. Men can carry trichomoniasis and chlamydia and have no symptoms, you can’t get certain STI’s without a man.

8. Wash your dirty hands and filthy nails. If you don’t wash you hands regularly and have black under your nails, you shouldn’t be rubbing any woman’s 🐱. 

9. Go see a Dentist. The bacteria in your mouth can transfer to a woman’s 🐱. How you want eat, when your eating utensils dirty?

10. Infected Razer bumps. You know how those bumps get so filled with puss, yes, bacteria and you want rub that on a woman’s 🐱 ...get a facial.

CREDIT: WOMEN’S HAVEN®️",https://www.reddit.com/r/Healthyhooha/comments/14v1sim/not_so_fun_facts_how_men_can_cause_vaginal_odors/,NOT SO FUN FACTS: HOW MEN CAN CAUSE VAGINAL ODORS & BACTERIA,,837,57,0.99,MrsAdderley
l8127u,Periods,1611947170.0,,https://i.redd.it/64em5sn0lbe61.jpg,Was told to post this here because it’s important.,Health,833,20,0.99,ExpertAccident
v4sqiv,Periods,1654361039.0,,https://i.redd.it/pp544au7vm391.jpg,Why is this so true,Fluff,826,54,0.99,_centaur_of_att
18yljil,Healthyhooha,1704396470.0,"I recently just had two UTIs back to back in the span of 3 weeks and seriously want to avoid that ever happening again. I'm pretty certain it's sex related because I've never had this happen to me before, only thing that really changed in my life is a new sex partner. 

I've read a fair amount of posts about D mannose and people taking a dose after sex, but sometimes I like to have sex sessions more than once a day, which seems like overkill for taking a dose each time. Would it be just as effective if I just took one dose of 1000mg every morning?

Thanks!",https://www.reddit.com/r/Healthyhooha/comments/18yljil/d_mannose_daily_before_sex_or_after_sex/,"D mannose - daily, before sex, or after sex?",Advice Needed ,817,22,1.0,rose-throwaway
n9g152,Periods,1620680601.0,,https://i.redd.it/idr9ojjzxcy61.jpg,hormones,Fluff,817,11,1.0,_BoredAccountant
lj8n9p,Periods,1613248536.0,,https://i.redd.it/vgojmnen2bh61.jpg,The ONE DAY I let my guard down,Fluff,808,27,1.0,FallingBackToEarth
hw658k,Periods,1595465777.0,,https://i.redd.it/ljy3p6289ic51.jpg,I literally try to eat healthy but whatever >:V,Rants n Raves,802,15,0.99,None
1913kos,Healthyhooha,1704664025.0,"Desperately looking for help over here! 25F who is on antidepressants (SSRI, citalopram 20mg) and has an IUD (I think mirena) having vaginal dryness and burning, especially with sex. It seriously feels like a knife is inside me sometimes when my partner is in me.

This sensition started about 2 weeks ago and I took an OTC monostat for a possible yeast infection. My vulva sometimes was burning/having unpleasant sensations when not having sex. However, I was never swabbed or diagnosed with a yeast infection, but have had similar feelings when I had a prior yeast infection about 2 years ago. I never had this burning before 2 weeks ago with this partner and we are exclusive.

I’m still having the burning! I have a very nice partner who is not forcing anything, but I am getting very frustrated with my own body! Is it just the combo of an IUD with antidepressants doing this to me? Are my antidepressants even a high enough dose to do that? I def am dry and need lube on a regular basis, but even with the lube I’m getting that dry, stabbing feeling now, post monostat. 

I have scheduled a doctors appointment but the soonest they can see me is mid Feb. Would this be worth going to urgent care? I don’t know if they could help me there.

Thank you so much. Any advice would be greatly appreciated.",https://www.reddit.com/r/Healthyhooha/comments/1913kos/help_vaginal_dryness_and_pain_with_sex/,Help! Vaginal Dryness and Pain with Sex,Advice Needed ,801,26,1.0,Mountain-Charity8683
1cdz14f,Healthyhooha,1714171754.0,"HI there! 39F! I I'm currently having major issues in the bedroom with my husband considering my hoo-ha just will not get wet or she will not stay wet. 

After trying many things, switching it up and all I still am having her becoming the Sahara Desert!!! 

My husband and I have been going through the IVF process often on for the past couple of weeks, So I did a lot of research and It is shown that those hormones can cause low libido and vaginal dryness. 

Especially because I also take an anxiety medication as well.

So this is where I would like the help and advice from you all!

I've read that ""Soaking wet"" is a really good vitamin to take and that it would help with vaginal dryness as well as ""Happy V""

Can any of you relate to my concern when it comes to a vaginal dryness caused by medications? I definitely appreciate it if someone could steer  me in the right direction with what would help my hooha be happy again?",https://www.reddit.com/r/Healthyhooha/comments/1cdz14f/meds_causing_her_to_be_dry/,Meds causing her to be dry!!!,Advice Needed ,825,13,1.0,Ru1384
os057r,Periods,1627310704.0,,https://i.redd.it/ttc7560pkkd71.jpg,Where is the lie?,Rants n Raves,795,4,1.0,nogagreflex69
iof6ts,Healthyhooha,1599509871.0,"I was talking to my mom about it, and she made the point that when she was my age (22), lots of women were still douching and thought discharge and wetness down there were bad. WAP celebrates female sexuality and normalizes wetness and eating girls out, which is now becoming the norm in media I think. I was just wondering your guys’ thoughts on it. Whether or not you actually like the song itself, I think it’s really interesting how things are changing in that regard.",https://www.reddit.com/r/Healthyhooha/comments/iof6ts/anyone_else_really_appreciate_the_song_wap/,Anyone else really appreciate the song WAP?,Question 🙋‍♀️,794,83,0.97,squishymonkey
o6xmoq,Periods,1624527941.0,,https://i.redd.it/4l8ubaz3q6771.jpg,I wanna die,Fluff,786,28,1.0,ramblingsofambrette
g3438l,Healthyhooha,1587137102.0,,https://i.redd.it/bnscvplmiat41.jpg,amirite?,,782,10,1.0,wheredidalfgo
np6nwx,Healthyhooha,1622476675.0,"Can someone please explain to me why we as a society place all the responsibility around safe sex on women? Isn't it a two way street? 

Men just go around casually cream pieing everyone and expect them to be on contraception, because they don't enjoy protected sex? 

Or they'll agree to ""safe"" sex and then stealth you 🙈

I mean yeah I can understand if you're in a long term relationship and you've been tested, that's different, but casual? 

Mhm spread that chlamydia, gonorrhea, HIV, as long as it feels good for a dude right? 🤷🏼‍♀️
Don't be afraid to stand your ground and say no if they refuse to take responsibility 🙋🏼‍♀️",https://www.reddit.com/r/Healthyhooha/comments/np6nwx/condoms_dont_feel_good_yeah_neither_do_chronic_bv/,"""CoNdOmS DoNt FeEL gOoD"" Yeah, neither do chronic BV boo 🤷🏼‍♀️",Question 🙋‍♀️,786,57,0.99,LollysAndCiggys
i48i58,Periods,1596644888.0,"Last year I was diagnosed with uterine cancer at the age of 38. I underwent months of treatment, including a radical hysterectomy, chemotherapy, and targeted radiation. Thankfully I'm currently NED (no evidence of disease) and I'm hopeful that it won't return. This is the story of how I found out I had cancer, my hope is that by sharing it maybe it will encourage others to go to the doctor and get screened before it's too late. ***Fair warning some of this is a little graphic.***

It started about six to eight months before my diagnosis. It happened gradually. My periods started getting heavier and longer. At first I blamed it on stress and weight fluctuations. I was under a ton of stress at work and actually ended up quitting my job (after being there almost a decade). I had also recently lost 70 pounds and regained 30 of it. Surely this must be the reason for my crazy periods, right? (Edit to add: my periods were often irregular so that's another reason I didn't take it seriously at first.)  

Eventually it got to the point where my periods just didn't stop. Yet I put off going to the doctor and continued to make rationalizations. It's important to note that the heavy, out-of-the-ordinary bleeding was the *only* symptom I had. I was not in pain, had no cramps, nothing else odd or worrying. I learned later that this is not unusual. Heavier/longer periods is often the only warning sign most uterine/ovarian cancer patients get, it also happens in about 90% of endometrial cancer cases. I wish I had known that.  

Then it happened. The day came when I couldn't ignore it anymore. I was at my new job going about my day when I suddenly had what can only be described as a contraction. (I've never been pregnant or given birth, so it was like nothing I've ever felt before.) Instinctively I knew what was about to happen and ran to the bathroom. I spent the next hour hemorrhaging blood and endometrial tissue. It was traumatic and disgusting.   

I had a friend drive me to the emergency room. I had lost so much blood that I ultimately ended up needing five blood transfusions. At first the doctor thought I might be having a miscarriage, but I definitely wasn't pregnant. So they did a pelvic exam and an ultrasound. Immediately I was rushed into surgery to stop the bleeding and scrape out my uterus (common procedure called a D&C). I don't remember a lot of the details of that night, but I certainly remember my surgeon coming to speak to me afterward. She said she didn't have to wait for the pathology results to know I had cancer and that she was referring me to an oncologist for further treatment and a hysterectomy. Up until that point it had never occurred to me that it could be cancer. Somehow I'd completely blocked out that possibility - considered every other option but that. Denial is a powerful thing.   

So, if you have increasingly heavier or longer than normal periods (or bleeding after menopause) does that mean you have cancer? No, not necessarily. Other things can cause it. But it does mean you NEED to get *thoroughly* checked out by a doctor. Ask for a CA-125 blood test, ultrasound, and/or biopsy to screen for cancer (and if they refuse say you want their refusal documented in your chart and that you want a copy). Some doctors might just try to give you birth control pills and send you on your way, don't let them. Be your own advocate. If they say you're ""too young"" to have cancer that's a red flag, my cancer support group is full of 20 and 30 year olds who were told this. Sadly some were not taken seriously until it was too late. It is also important to note that a pap smear only checks for cervical cancer, not uterine or ovarian cancer. So listen to your body and if something is out of the ordinary get checked out.  

TL;DR increasingly heavy/irregular/longer than normal periods are often the *only* warning sign of uterine or ovarian cancer.",https://www.reddit.com/r/Periods/comments/i48i58/how_i_found_out_i_had_uterine_cancer_and_what/,How I found out I had uterine cancer and what every woman should know about her period...,Health,775,62,1.0,digitalvagrant
jj2rhu,Healthyhooha,1603810975.0,"Omg im so excited. So I have been seeing this guy and let's just say he's ""blessed"" down there. Anyway, we tried to have sex twice and I just could not do it due to pain ( I deal with painful sex regularly thanks vagina ugh). Anyway he was so patient with me and made sure to take his time with foreplay and really relaxing me, and when he was going down on me I was like OK yeah its time and he did and he was so gentle and it WORKED with minimal pain. I was so happy I could cry. He's such a great dude and I was getting really nervous that sex was going to be a real issue. So happy.",https://www.reddit.com/r/Healthyhooha/comments/jj2rhu/sex_worked/,SEX WORKED,,773,23,0.99,athenasykora
mwjk9b,Periods,1619139681.0,,https://i.redd.it/93dld1q1otu61.jpg,I found this funny 😂,Fluff,768,5,1.0,ArtisticSoul2019
hps2qf,Periods,1594548433.0,,https://i.redd.it/v4bslp3mhea51.png,aint this the truth,Fluff,757,11,1.0,millie_likes_cake
gjixvn,Periods,1589448119.0,,https://i.redd.it/n64nkqhs7py41.jpg,🙃,Fluff,757,9,1.0,None
jm3ysa,WomensHealth,1604244173.0,,https://www.theguardian.com/lifeandstyle/2020/nov/01/the-sole-function-of-the-clitoris-is-female-orgasm-is-that-why-its-ignored-by-medical-science,The sole function of the clitoris is female orgasm. Is that why it’s ignored by medical science?,Article,756,243,1.0,Mcbuffalopants
nfwxzh,Healthyhooha,1621401668.0,"Hello, Reddit friends. The comments on my last post were turned off but, I had vented about being suicidal because of my lifelong battle of BV/yeast. A few ladies told me to test for mycoplasma and ureaplasma, which I had never heard of before. Of course, I had taken a swab test bc I felt “weird” down there and assumed it was yeast. My gyno looked inside and said it looked healthy with no strange discharge. Results for bv/yeast came back negative. I was really upset at first until a few days later, when I found out I am indeed positive for ureaplasma. I finally have the culprit to my issues! I literally cried in Walmart. I wish I could respond to the ladies on my last post! I wish I could hug you!!! I am so happy!!!! I know I will finally be normal and won’t be embarrassed for how I smell ever again. I will update you guys on the healing process as I still don’t know much about it or this bacteria. But FROM THE  BOTTOM OF MY HEART, I want to say that I truly love you all and am so grateful that you guys took time out of your day to uplift me! I wish I could repay each one of you. Thank you for making the internet world a better place! Love you soooo much💜",https://www.reddit.com/r/Healthyhooha/comments/nfwxzh/suicidal_odor/,Suicidal Odor,,740,24,1.0,PrettyTrainwreckkk
iubtsw,Periods,1600314832.0,,https://i.redd.it/5vynaop3smn51.jpg,"I’m on day two, and I had a nasty panic attack in the shower while being hit by a wave of cramps. Made this as a way to vent my frustration.",Rants n Raves,737,38,0.99,TwentyYearsLost89
vpcpy2,Periods,1656714199.0,,https://i.imgur.com/sDqOr6p.jpg,Facts 😂,Fluff,737,20,1.0,None
jwlek6,Periods,1605724497.0,,https://i.redd.it/fp1bs7rml1061.jpg,commence past teenager me crying in the bathroom,Fluff,741,33,1.0,None
otnq64,Periods,1627522260.0,,https://i.redd.it/w1fjqo2r12e71.jpg,This is what packing for a 4 day camping trip with a heavy and painful period looks like,Rants n Raves,737,87,0.99,Paladin3618
inilej,Periods,1599381177.0,,https://i.redd.it/jk4m2vcvnhl51.jpg,Ah period poops...,Rants n Raves,731,22,1.0,None
k52djm,Periods,1606883899.0,,https://i.redd.it/1lrmezb8dp261.jpg,destroyed half of my stock!,Rants n Raves,721,9,1.0,island_kissed228
o5xtiu,Periods,1624397447.0,,https://i.redd.it/d6y96p13yv671.jpg,Thread and beading,Fluff,730,20,0.98,pigfacesyndrome
m2v4j8,Periods,1615482439.0,,https://i.redd.it/fk7p0mp6lfm61.jpg,Made a hot water bottle holder for my partner!,Products,719,26,0.99,whoopdawhoop12345
k7230b,Periods,1607147085.0,,https://i.redd.it/zybpk56u3b361.png,AM I THE ONLY ONE?!,Rants n Raves,720,13,1.0,island_kissed228
kpraz6,Periods,1609702771.0,,https://i.redd.it/x0n7u1k976961.jpg,"Me on my period, getting out of bed, trying to get to the bathroom before everything falls out of me",Fluff,713,23,1.0,None
j31c8u,Periods,1601524560.0,,https://i.redd.it/t37dh3k0peq51.png,Do you hate it when your blood does this?,Fluff,701,26,1.0,uwu11111
n0yh2v,Periods,1619678009.0,,https://i.redd.it/hgi21mur42w61.jpg,I wish it was a myth,Fluff,695,59,1.0,theunknownsource22
g1g1ov,Periods,1586905584.0,,https://i.redd.it/ftvfwh3j7vs41.jpg,I'm more excited about my upcoming period than I am about my upcoming check,Fluff,697,11,1.0,None
ujt7yv,Periods,1651859746.0,,https://i.redd.it/v4rznl3l9wx81.jpg,Every time,Fluff,689,10,1.0,kim_possible9
lv6arj,Healthyhooha,1614596130.0,"I kept getting buildups no matter what. Cotton underwear, fragrance-free soap, washing my private area last, shaving, not shaving, trimming. Hell, I let that shit BREATHE from time to time whenever I was home alone. Nothing. It was just me, and my god forsaken dead skin greeting me the morning after I’d just shower. 

*What could it be?* I think to myself after taking a piss, using a Cottonelle wipe that is meant for *just* your ass...

Oh. Cottonelle wipes are meant *just* for your ass. Not your sensitive, scent-rebuking pH that screams every time you’d think you’re freshening up for the past [REDACTED] months.

As soon as I stopped using them, I have been smegma-free. I didn’t even like the smell of them, nor did I feel *that* clean using them. It’s just a matter of my brain being like *ha ha yes wipe good no pee.*

I am so stupid, I am going to catapult myself into the blazing hot sun.",https://www.reddit.com/r/Healthyhooha/comments/lv6arj/i_got_rid_of_my_damned_smegma_problem/,I got rid of my damned smegma problem.,Rant 🤬,685,48,0.99,TenorTerrace
i3audp,Periods,1596507430.0,,https://i.redd.it/osi76otqawe51.jpg,"This is a bit too tmi, but I know it happens to pad users and it makes me gag (again, sorry for the tmi, just trying to be relatable)",Rants n Raves,682,69,0.99,None
kssdkk,Periods,1610070647.0,,https://i.redd.it/zgl5ff95l0a61.jpg,If I had a super power (OC),Fluff,681,11,1.0,Doodley-Squat-Comics
org5ot,Periods,1627235090.0,,https://www.reddit.com/gallery/org5ot,Someone made a point that we need more period memes. We do.,Fluff,679,16,1.0,Barfbag720
lz4fya,Periods,1615046216.0,,https://i.redd.it/uoun9dm2kfl61.jpg,"Periods don’t make us crazy, they make us more honest. ;)",Fluff,677,18,0.99,writerrani
fibalj,Healthyhooha,1584151845.0,,https://i.redd.it/yl49asu8rjm41.jpg,"Needed pads for this week, Thanks Coronavirus...",,668,70,0.99,Terracrush
lm4dkl,WomensHealth,1613595158.0,"I just realized that when I was with my toxic ex, I could NEVER get wet and I always had some sort of UTI or yeast infection but after reading that your body rejects a man before your mind will (maybe not all the time, but this time it did apply for me) my world has been changed!! I now am with someone else who my vagina gladly welcomes inside and never have had a uti or infection with him. What a great day to realize that i wasn’t broken, just wrong person! ¡Namaste!",https://www.reddit.com/r/WomensHealth/comments/lm4dkl/i_cant_believe_my_beautiful_vagina_has_my_back/,I can’t believe my beautiful vagina has my back,,656,81,0.99,None
jx8b12,Periods,1605810780.0,,https://i.redd.it/mjc6ruqdq8061.jpg,Me randomly talking to people and having fun and then period pain strikes.,PMS,661,11,0.99,MrsSpock01
r4kk1r,Periods,1638151266.0,,https://i.redd.it/l15wf8z8zf281.jpg,only one week😭,Discussion,655,24,1.0,Just-Vermicelli263
htrq5d,Healthyhooha,1595119994.0,,https://i.redd.it/gqodefu5ppb51.jpg,"And this, my fellow sufferers, is why it is so incredibly hard to find a dr who knows wtf they are doing and how to treat us",Rant 🤬,656,16,1.0,Thelastunicorn80
l2sipq,Periods,1611336649.0,,https://i.redd.it/bskce8qi5xc61.png,"when you start your period, but don't have a quarter",Period Question,650,15,0.99,GoAuntFlow
l2cgtc,Healthyhooha,1611277612.0,"I was talking to my friends one night recently, and the topic shifted to vaginal health somehow. We were talking about how irritating it is society deems vaginal tightness as a goal, and how we'd give anything to be looser. After we said this, a friend got emotional and told us how she thought she was the only one with Vaginismus because its not openly spoken about. This friend is in her 30s guys.
 Imagine carrying that around with you for all those years, the shame, the guilt, the anger. 

And then it got us all thinking, why is none of this ever spoken about? Sex Ed at school? If you're lucky to get any in the first place, all you're taught is how pregnancy happens, a bit about STIs and birth control. That's all. Why aren't we talking about COMMON issues? No ones being taught about:
 Painful Sex,
Vaginal Dryness,
Discharge,
 Thrush, 
Bacterial Vaginosis,
Menstruation and what the different shades of blood are, or clots. 
The Vagina is self cleaning, so only clean the vulva.

Can you imagine how many young vagina- owners there are going round thinking they're not normal, when in reality, they're pretty normal. 

How many are carrying this with them into adulthood and not speaking to anyone about it because its seen as taboo? 

It just makes me real sad guys, things need to change 💜",https://www.reddit.com/r/Healthyhooha/comments/l2cgtc/why_does_nobody_talk_about_this_stuff/,Why does nobody talk about this stuff?,Rant 🤬,642,60,0.99,LollysAndCiggys
egh7gb,Periods,1577482150.0,,https://i.redd.it/dqgar5ntu8741.jpg,Me on my period: *sits on the toilet* The entire lining of my uterus:,Rants n Raves,642,6,1.0,-extra_ordinary-
roakef,Periods,1640441835.0,,https://i.redd.it/qs8i53l86p781.png,I'm not moving anytime soon,Fluff,637,10,1.0,SoulProxy00
jut32h,Periods,1605472915.0,,https://www.reddit.com/gallery/jut32h,I finally finished making my first set of reusable pads! I am super excited to try them.,Products,640,59,0.99,GladSpell757
kbiudz,Periods,1607747833.0,,https://i.redd.it/anecnv88qo461.jpg,I just KNOW that those damn cramps are just waiting to strike!,PMS,635,16,1.0,FancySocks1989
hwen50,Periods,1595506730.0,,https://i.redd.it/u99ry7i5nlc51.jpg,Same,Rants n Raves,639,13,0.99,justme2936
hedubi,Periods,1592915839.0,,https://i.redd.it/5smhvxf2nn651.jpg,I tried to make pomegranate tea and got flashbacks,Fluff,635,9,1.0,ElevenStrange123
