post_id,subreddit,created_utc,selftext,post_url,post_title,link_flair_text,score,num_comments,upvote_ratio,post_author
kf0d1g,WomensHealth,1608221775.0,"Hey! I spoke with them on the phone, and they refused to change anything. We need more signatures. 🙏🏻

[https://www.change.org/p/american-college-of-ob-gyns-get-nerves-of-the-clitoris-into-american-college-of-ob-gyn-curriculu](https://www.change.org/p/american-college-of-ob-gyns-get-nerves-of-the-clitoris-into-american-college-of-ob-gyn-curriculum)m

28,000 signatures so far! 

16 years ago, I was robbed of clitoral sensation permanently due to OB/GYN ignorance of clitoral anatomy. The nerves in the clitoris still aren’t getting taught, putting other women at risk. Please help me change this so that other women are not harmed like I was. 

The nerves in the clitoris are 2-3 mm in diameter and travel superficially under the clitoral hood skin.

As such, they are vulnerable to injury and put at risk in a number of procedures OB/GYNs perform: biopsies, clitoral hood reductions, and repairs after childbirth, sexual assault, and straddle injuries. Understanding this anatomy is also important in diagnosing and managing female sexual dysfunction. 

Unfortunately, though the nerves in the clitoris were published in 1844 and many times since, they were omitted from OB/GYN literature until 2019. Though I’ve gotten studies published and multiple textbooks updated with this anatomy, it’s still not getting taught to most OB/GYNs. 

The American College of OB/GYNs has the power to help dictate what gets taught. But they recently said, in an email, that the nerves in the clitoris “do not fit” in their recommended CREOG curriculum for OB/GYNs. 

If they would include it, this would help ensure OB/GYNs are being taught this anatomy, which is critical for female sexual function.   


Personally, the nerves in my clitoris were injured in a clitoral hood reduction done without my consent during a labiaplasty. I lost clitoral sensation permanently. After my surgery, I was told by every OB/GYN I went to for help that my loss couldn’t have been caused by my surgery and was all in my head. 

16 years later, not one top 20 OB/GYN program will agree to teach this anatomy, despite being entreated to do so by me and my plastic surgeon father. 

There are many other women with stories like mine, who have lost clitoral function after biopsies, cosmetic surgeries, and repairs (including one after a rape). Preventable damage done during repairs likely goes unrecognized because women assume the original injury caused the damage, rather than their doctor.   


My loss was so traumatic it felt sometimes worse than death. It is made more painful knowing my injury isn’t considered worth preventing. But it is worth preventing.",https://www.reddit.com/r/WomensHealth/comments/kf0d1g/please_sign_petition_to_get_nerves_in_the/,Please sign petition to get nerves in the clitoris included in ACOG’s curriculum. They say it “doesn’t fit.”,,2468,183,1.0,jessica_pin
dwup3z,Healthyhooha,1573842139.0,,https://i.redd.it/ua4z8e477wy31.jpg,I know this is apart of the standardized procedure and what not but it’s still kind of funny.,,2406,49,0.99,None
hamqgj,Periods,1592379858.0,,https://i.redd.it/h83zzjacdf551.jpg,I'm sure every person here relates.,Fluff,2354,16,1.0,noorhaider97
j8mxtl,Periods,1602345619.0,,https://i.redd.it/2fo1u3ioias51.jpg,🩸,Fluff,2177,16,1.0,None
mqc0v5,Periods,1618349331.0,,https://i.redd.it/83x11rfxd0t61.jpg,why is this so true?,Fluff,2113,72,1.0,KitKat1287
gpy8iy,Healthyhooha,1590357229.0,,https://i.redd.it/enjb75g1bs051.jpg,Idk if memes are allowed here but 🙈,,1950,25,1.0,minecraftgardener
kzm7ss,Periods,1610940981.0,,https://i.redd.it/07ypxyf1h0c61.png,The most relatable thing I've seen today,Fluff,1946,48,0.99,None
i4wufc,Periods,1596737305.0,,https://i.redd.it/g3uuvk9aaff51.jpg,True love 💕,Fluff,1873,24,1.0,crystalbellemaryanne
iasl2x,Periods,1597585567.0,,https://i.redd.it/83l41hqhcdh51.jpg,ugh,Rants n Raves,1867,43,1.0,pureed_chicken
hvs4yn,Periods,1595417507.0,,https://i.redd.it/qjmox5eu9ec51.jpg,"Relatable, literally me rn",Rants n Raves,1739,32,1.0,GiaTheGiraffe01
fvs2gz,Periods,1586146959.0,,https://i.redd.it/c1slqhyqj4r41.jpg,"I made a meme, hope you all have a laugh!",Fluff,1703,11,1.0,xmuertos
t5k3mr,Healthyhooha,1646285018.0,"So my legs are spread, the speculum is in and my male gyno staring into my vagina goes ""it's a bit wet today"".

I felt my face go red out of embarrassment and kind of went into shock before saying ""Oh really?""

He then goes, ""Yeah the rain has been non-stop"".

I then realise he was talking about the fucking weather lmao.",https://www.reddit.com/r/Healthyhooha/comments/t5k3mr/when_your_gyno_is_says_its_a_bit_wet_today_while/,"When your gyno is says ""it's a bit wet today"" while inspecting your vagina.",,1680,66,0.99,sushimario
e8awbg,Periods,1575903067.0,"There has been a lot of brigading and spamming on this sub the last few days. This is apparently over the false belief that ""men have periods"". While I am certainly not the person to tell people how to live their lives, there is one simple truth that will not be denied here

MEN DO NOT GET PERIODS

If you are a person who menstruates, you are, by definition, FEMALE.

If you consider yourself a ""TRANSMAN"" that's fine, just know that you should not be surprised if others on this sub do not agree with you.

""TRANSMEN"" can certainly post, as all are welcome, but please DO NOT spam this sub with ""MEN HAVE PERIODS TOO"" because this is demonstrably and scientifically FALSE.

Thank you!",https://www.reddit.com/r/Periods/comments/e8awbg/to_be_clear_men_do_not_have_periods/,To Be Clear - MEN DO NOT HAVE PERIODS,Discussion,1619,751,0.91,None
18zew66,Healthyhooha,1704482097.0,"I’ve recently stumbled across these probiotic supplements that say they’re for supporting vaginal PH, vaginal odor, yeast balance and vaginal flora. I’m wondering if anyone’s tried them and if they work well. Or if anyone has recommendations for some similar products. I’ll post the link to the website in the comments so if anyone could tell me if the ingredients are bad I’d really appreciate it.",https://www.reddit.com/r/Healthyhooha/comments/18zew66/looking_to_see_if_anyone_has_tried_the_uro/,Looking to see if anyone has tried the Uro vaginal probiotics,Question ,1604,12,1.0,CeilNordique
doxx2x,Healthyhooha,1572390093.0,,https://i.redd.it/9s2xqasi9kv31.png,am i right or am i right?,,1592,44,0.99,None
11w7bge,Healthyhooha,1679283247.0,"I’ve been using love wellness and want to try another brand , is there any recommendations for a really good brand?",https://www.reddit.com/r/Healthyhooha/comments/11w7bge/best_probiotic_for_vagina/,Best probiotic for vagina ?,Question ,1528,9,1.0,TherealGabbie
d3cmmd,Healthyhooha,1568314940.0,,https://i.imgur.com/y6FAsgL.jpg,"bath bomb:1, hooha:0",,1503,67,1.0,ellenty
ij045x,Periods,1598734837.0,"This is not a debate sub and gender identity whatever discussions are not welcome here. If the sole purpose of your post is to stoke these flames and troll, you will be banned and reported to the admins for brigading. 

This is a sub about PERIODS. No one cares what your gender identity is, and those discussions are best suited for somewhere else.

If you have a period, then you are in the right place. If you don't and have questions, you have found the right place. DO NOT come here trying to start crap and nonsense. Anyone abusing the report button will also be BANNED.

Edit: If you feel that this sub is not ""inclusive"" enough for you, we can refer you to r/ftm or /r/menstruationstation",https://www.reddit.com/r/Periods/comments/ij045x/effective_immediately_anyone_coming_to_this_sub/,"Effective immediately, anyone coming to this sub posting anything akin to ""but what about transmen and nonbinary people"" will be immediately BANNED",Announcement,1483,2,0.95,UrPrettyMuchNuthin
iri61y,Healthyhooha,1599936173.0,,https://i.redd.it/bk8pcbu5irm51.jpg,Does anyone know where I can get these tampons? They’re definitely going to make some great Christmas gifts this year.,Menstruation 🔴,1471,18,1.0,hakuna_masquata
hurk7f,Periods,1595272353.0,,https://i.redd.it/viekp8b8a2c51.jpg,Ah yes. Very helpful. thank you for providing me with this really intuitive and precise information. Thank you.,Discussion,1451,72,1.0,Hiking-Biking-Viking
i7p3dd,Periods,1597140332.0,,https://i.redd.it/zw03fkqokcg51.jpg,Me on my period,Fluff,1433,21,1.0,ihatelifexoxox
16hw5d3,Healthyhooha,1694632910.0,"Went out with a guy last night. Y’all, tell me why he had the nerve to say I killed the mood because I asked him to wash his hands before touching my girl. Now, mind you. We went to a pool hall, had drinks, and a hookah bar. We got back to his place and he left the condoms in the car and had to go back and get them, I told him to wash his hands again 😂. (And he has a cute 🐈‍⬛ we were playing with) He was upset, but I didn’t give a fck. DO NOT TOUCH HER WITHOUT WASHING! I have been struggling with bv for YEARS and it’s calm right now. My vag feels good and she’s balanced! I cannot risk it for anybody, not even a moment! Idc",https://www.reddit.com/r/Healthyhooha/comments/16hw5d3/do_not_touch_my_vag_without_washing_your_hands/,DO NOT TOUCH MY VAG WITHOUT WASHING YOUR HANDS‼️,Rant 🤬,1421,106,0.98,hotestablishment007
lisehn,Periods,1613187783.0,,https://i.redd.it/zp1i6ayz16h61.jpg,Then I have to do the weird crab walk afterwards...,Fluff,1421,15,1.0,butterflyhighhh
ijk6de,Periods,1598820444.0,,https://i.redd.it/ecrmi3ric7k51.jpg,When that poop AND period cramp hits for the 50th time today,Rants n Raves,1401,25,1.0,SeikoAki
m3hlvt,Periods,1615555940.0,,https://i.redd.it/iqkvkmuqnlm61.jpg,I’m amazed nature hasn’t found a better solution,Fluff,1397,17,1.0,Uselessschoogirl
dia2c8,Healthyhooha,1571155747.0,,https://i.redd.it/wku1kri6bqs31.jpg,Found this gem today and had to share!,,1383,6,1.0,badbvtch
ci5q5d,Healthyhooha,1564161722.0,,https://i.redd.it/83k6qgsbmoc31.jpg,She’s not wrong,,1329,41,0.99,aDomesticatedGiraffe
c8pxff,Healthyhooha,1562170123.0,,https://i.redd.it/rr09jp1b44831.jpg,Thought you guys might think this was funny,,1301,17,1.0,Uhhlaneuh
lqi4ow,Periods,1614086004.0,,https://i.redd.it/haoznmgv88j61.jpg,Pretty much,Fluff,1290,17,0.99,None
j9paic,Periods,1602502701.0,,https://i.redd.it/0f0fdegfhns51.jpg,I wish tampons and pads looked this fun when I was growing up. Great way to normalize periods which sadly still aren't.,Products,1276,51,1.0,glamasaurus
gkempq,Periods,1589567356.0,,https://i.redd.it/t9vm8ohb2zy41.jpg,🤣 I just had a flashback of elementary/middle school + high school all in one!,Fluff,1263,30,1.0,None
hzdg7q,Periods,1595937853.0,,https://i.redd.it/hdv592o09ld51.png,(silently) Don't,Fluff,1250,17,1.0,epmtunes
dzej2h,Healthyhooha,1574313640.0,,https://i.redd.it/t46yn2nfwwz31.jpg,Love your hooha,,1232,6,0.99,clendificent
j40ojq,Periods,1601665253.0,,https://imgur.com/14bC9B7.jpg,Flubber [OC],Fluff,1227,35,1.0,lemon_cello
17rv9hj,WomensHealth,1699587532.0,I’ve been looking around and I honestly don’t know what to get . I’ve also read so many reviews it’s stressing me out!,https://www.reddit.com/r/WomensHealth/comments/17rv9hj/whats_the_best_vaginal_probiotics_do_you_guys/,What’s the best vaginal probiotics do you guys recommend?,Question,1219,28,1.0,iamvictorious21
kr5mot,Periods,1609874766.0,,https://i.redd.it/4tml6y7pek961.jpg,This is amazing,Discussion,1220,54,1.0,None
jd7oo9,Periods,1602985821.0,,https://i.redd.it/f4qag0oaert51.jpg,showed my bf my period journal and he asked me why i’m “obsessed with my period”. so I’m sharing it here bc i think it’s cute,Health,1202,69,1.0,thr0vvavvay-
bjb9u3,Healthyhooha,1556672748.0,,https://i.redd.it/l8jr5dds1iv21.jpg,When your boyfriend asks “what are cooking?” And takes the lid off of your pot of boiling water with your Diva cup in it before you get the chance to respond.,,1192,30,0.99,xGiaMariex
dfy31p,WomensHealth,1570714464.0,"We at r/WomensHealth respect a woman's right to make her own medical decisions. We do **not** condone anti-choice content. If you see anti-choice content, please use the report feature to bring it to my attention.

Thanks,

A",https://www.reddit.com/r/WomensHealth/comments/dfy31p/reminder_antichoice_content_is_not_welcome_on/,Reminder: Anti-choice content is not welcome on this sub,,1177,20,0.99,scienceraccoon
kcp3j7,Periods,1607914756.0,,https://v.redd.it/ruuwroogi2561,Nothin but the truth,Rants n Raves,1178,17,0.99,poplitte2
iyf3my,Periods,1600883344.0,,https://i.redd.it/5gr0eoukqxo51.jpg,Made myself a little bag for my tampons inspired by Legend of Zelda: Breath of the Wild,Fluff,1178,39,1.0,suzy_snowflake
caoizt,Healthyhooha,1562609075.0,"Saw this nice Healthy Hooha reminder on Facebook (kudos to  [Crystal Tommy James](https://www.facebook.com/sukamonkeenut01?__tn__=%2CdCH-R-R&eid=ARBAIoXCcFQ4DLobgCLAHFw1jg4DhBLB9pN7iOWqy85mv02KSTKgKRObZZqE6ncJBXPaRWAslvk__IQk&hc_ref=ARS1mtGBL4DfBwNv1Vpxm01-rrdYZ5G8hisKOz8q2_f5bLG8181kgnmPXY2HmmtydCs&fref=nf) for this post) and thought it had to be shared to the world :

 

1. Vaginal discharge is normal.

2. Wearing panty liners 24/7 is not necessary.

3. Vaginas are acidic enough to BLEACH fabric, hence the discoloration of underwear.

4. Longer labias are more normal than smaller ones (but both are fine).

5. A mans sperm CAN throw off your ph balance and also change the smell of your vagina

6. It is not safe for vaginas to smell like sunshine and flowers so quit expecting it to.

7. STOP douching and washing your vagina with bath&body works, and Victoria secret. Shits not healthy for the vagina.

8. The vagina cleans itself.

9. Having sex has no correlation of how ""tight"" your vagina is.

10. Yeast infections are COMMON!!!

11. The best thing you can do for your vagina is to leave it alone.😴

12. If your vagina stinks or your discharge stink and has a color than go see a gynecologist and stop trying to blame cause you stink.

13. Let it breathe.

14. The VAGINA is the narrow canal that runs INSIDE the body. NOT the whole genital area.  
\*Do not use soap in your vagina.\*

15. Always urinate after sex to rinse the urinary tract of fluids that could be caught there and can cause UTIs.

16. Drink water.

17. COTTON panties ladies. Wearing silk, satin and lace seven days a week will abso-fucking-lutely throw your Ph off.

Don't argue with me about this. I don't give a fuck if you say your mama put you in satin diapers and all you've ever worn is satin panties. If that's true, YOUR SHIT IS OFF.  I GUARANTEE it.

18. Stop sprinkling powder on your lady bits, stop IMMEDIATELY! Talcum causes cancer. This isn't a hoax or a joke and I don't care if your 97 year old great Aunt Myrtle has been using it twice a day, everyday. STOP IT! TODAY!

19. Also the Vagina is a natural sperm killer, except when you’re ovulating with the exception of a very high ph level.

20. This is all correct and true. Stop letting men who think washing their ass and moisturizing is gay try and tell you how to care for your ladybits. Ladies, stop letting boys who got sex ed from Pornhub tell you about YOUR vagina.

&#x200B;

[\#theyarekeepingitreal](https://www.facebook.com/hashtag/theyarekeepingitreal?source=feed_text&epa=HASHTAG) [\#vaginaadvocate](https://www.facebook.com/hashtag/vaginaadvocate?source=feed_text&epa=HASHTAG)

&#x200B;

Please get educated and pass on the good news above!",https://www.reddit.com/r/Healthyhooha/comments/caoizt/ladies_stop_letting_boys_who_got_sex_ed_from/,"Ladies, stop letting boys who got sex ed from Pornhub tell you about YOUR vagina, here's all you need to know!",,1158,96,0.99,funkylittlemonkey
j9djql,Periods,1602450415.0,,https://i.redd.it/xu46xyha6js51.jpg,Truth about tampon commercials,Rants n Raves,1150,13,0.99,None
ixsd4t,Periods,1600796825.0,,https://i.redd.it/sc3hfojblqo51.jpg,Can I use pasta instead of rice for a heat pad?,Fluff,1145,27,1.0,catty1701
h9thf4,Periods,1592270421.0,,https://v.redd.it/j954nihwb6551,I’m just going to leave this here for anyone who needs it,Discussion,1141,86,1.0,Tinydancr1
izpn7x,Periods,1601060505.0,,https://i.redd.it/6qwwjg1wccp51.png,And I don't even want kids!,Fluff,1122,34,1.0,xijenna
ijwj9k,Periods,1598874715.0,,https://i.redd.it/38mq9wtvtbk51.png,its true though,Fluff,1115,10,0.99,millie_likes_cake
1ckfcot,WomensHealth,1714870638.0,"ive been with my boyfriend for about two years now and before the last few months everything sexually had been great.  
  
I feel like im pretty healthy. I eat well and never really have problems with my periods or other things. 

recently we've been having some sexual issues (nothing from him), where I'm just not as wet as I'm used to being.

I noticed it about three weeks ago and have been in my head a bit ever since. I tried to fix the issue before he noticed but he's definitely noticing.   
  
last time we had sex he mentioned that we may need to start using lube. he's not angry or anything, but I'm worried it could get to that point.

i just bought some astroguide lube and lubracil sensation serum (both from Amazon), which I think will help, but was wondering if anyone has ever fixed this issue on their own?",https://www.reddit.com/r/WomensHealth/comments/1ckfcot/has_anything_helped_you_during_sex/,has anything helped you during sex?,Question,1095,90,1.0,TheDearlyt
l2f645,Periods,1611286674.0,,https://i.redd.it/g7573bw01tc61.jpg,Don’t I know the feeling 🙈 credit - unknown,PMS,1086,12,1.0,None
i9pw63,Periods,1597424895.0,,https://i.redd.it/361y3pbu20h51.jpg,Can relate,Fluff,1067,4,1.0,midorikeiko
hnpzmh,Periods,1594243699.0,,https://i.redd.it/v7it1jlhbp951.jpg,Every time,Rants n Raves,1039,30,0.99,hereforthecjrcus
ktm935,Periods,1610176344.0,,https://i.redd.it/uh2zq9ufb9a61.jpg,You wanna know what a period feels like?,Fluff,1017,12,0.99,Doodley-Squat-Comics
n2luwx,Periods,1619886721.0,,https://i.redd.it/oc1u9vnddjw61.jpg,I just got mine now. I was supposed to get it last weekend.,Fluff,1020,29,1.0,ArtisticSoul2019
p9fofl,Periods,1629649978.0,,https://i.redd.it/1uknc5yjsxi71.jpg,To anyone who thinks periods are disgusting and dirty.,Discussion,1017,42,0.99,Tiramisu05
la1ec8,Periods,1612180273.0,,https://i.redd.it/9jaws8r3uue61.png,thats enough to change it once every 100 minutes or 1hr 40 minutes,Discussion,1006,41,0.99,millie_likes_cake
ltmczu,Periods,1614425904.0,,https://i.redd.it/ph1ghmckb0k61.jpg,The pâįń,Fluff,1007,13,1.0,KitKat1287
fd2ptr,Healthyhooha,1583274269.0,,https://i.redd.it/djih77lr9jk41.jpg,I had to make a meme about my third experience of getting an annual exam.,,996,20,1.0,None
198i9lt,WomensHealth,1705449852.0,"hey! so basically i need some advice on how to have less painful sex. i’ve had 2 partners and with the first one he was about average and never caused me any pain (except for when i lost my vcard). my 2nd partner was much bigger and if we would have sex for a pretty long period of time or if it was on the rougher side it would start to feel painful. i know this is caused by vaginal dryness and the condom practically ripping my skin. i now have vestibular papillomatosis on both sides of my labia and i have blocked glands on my vulva from irritation due to the prolonged dry/rough sex. it’s not that i’m not turned on because everything is great for the first 15 minutes or so, but after that everything just goes downhill. does anyone have any suggestions for what i can do about this? any safe lube recommendations or ways to get rid of the irritation? i’ve also recently started birth control and read that it can cause vaginal dryness, does anyone else have something similar going on?",https://www.reddit.com/r/WomensHealth/comments/198i9lt/advice_on_how_to_fix_painful_sex/,advice on how to fix painful sex,,1021,19,1.0,nikkibella5114
ot3wx6,Periods,1627451621.0,,https://i.redd.it/zidkcdvo7wd71.jpg,(Will delete if repost or goes past community guidelines idk how tho),Fluff,984,25,1.0,AnimeandRamenFan
1bvmt73,Healthyhooha,1712236401.0,"I had a laparoscopy for endometriosis 5 months ago and ever since, my vagina/vulva has had what I can only describe as “cotton mouth”. It’s sooo dry!! I’ve tried stopping birth control, using vaginal moisturizers, vaseline, and even Vaginal Estrogen cream which burned. Nothing has helped. Sex is so painful even with lube. I’m usually burning everytime after sex. Help! I’m 35F so not sure if it’s age or related to my surgery. ",https://www.reddit.com/r/Healthyhooha/comments/1bvmt73/my_vagina_has_cotton_mouth/,My vagina has “cotton mouth”,Question ,981,30,0.99,shadyblonde231
18x4jbr,Healthyhooha,1704239783.0,"i’m looking for one that support vaginal and digestive health. especially for yeast infections. and IBS D. 

It’s my first time taking them. I came across good reviews on Garden of Life, Dr. Formulated Women's Probiotics Once Daily, 16 Strains, 50 Billion, 30 Capsules. Should i take this?Confused about the 50 billion thing.",https://www.reddit.com/r/Healthyhooha/comments/18x4jbr/which_probiotic_is_good/,which probiotic is good?,Advice Needed ,977,9,1.0,love_frogs101
1abuswl,Healthyhooha,1706307894.0,"Hey everyone, so I’m a year into a horrible yeast/bv/strep infection that refuses to go away. I’ve tried everything at this point. I know that probiotics are an important step to keep the infections from coming back, but I can’t seem to find a good vaginal probiotic. I can’t use vagibiom because it has coconut oil in it, and that’s the reason I’m in this situation to begin with. Do any of you have recommendation for a good vaginal probiotic? I’m desperate :(",https://www.reddit.com/r/Healthyhooha/comments/1abuswl/vaginal_probiotics/,Vaginal Probiotics,,974,60,1.0,Grape_Fruit109
hkpr64,Periods,1593806080.0,,https://i.redd.it/2olvnif86p851.jpg,A vintage birth control ad.,Birth Control,976,10,1.0,hereforthecjrcus
16mput6,WomensHealth,1695127073.0,"So I am 40 I decided I was done having kids and wanted to go back on BC. 

I went to the gynaecologist here in Greece where I live now. I was dreading it because all my experiences with the GYNO in America have been shoving fingers uncomfortably into you and pressing just uncomfortable. 

My exam in Greece was done w a very slender ultrasound wand. No pain. No Rando up in my business. 

We then discussed Birth control. Here you get blood work first and then they prescribe a Birth control pill that pairs with your blood work results. - literally never in America 

Then he told me that after 40 they are hesitant to prescribe the pill because that can increase breast cancer and before 40 the pill can cause blood clots which is why they make all women regardless of age do blood work before they prescribe BC pills (which is free here BTW) - did NOT know any of this. 

He then suggested an IUD. The Mirena which I heard was super painful to insert. 

Here in Greece they insert it at a hospital with General anesthesia because it hurts so bad. It takes an HR and is an in and out patient procedure simple stream lined no pain. 

He then told me that they are NOT ever supposed to insert it in the office unless the women has had a vaginal birth and even then it would probably hurt. They can however remove it in the office. 

In America they make women suffer regardless of how the Mierna IUD guidelines because they are too cheap to care about us.

 The US health care is complete and utter garbage. 

I actually have health care here because I’m working so I pay into the Greek tax payers system. Which just mean prescriptions are free and any public hospital is free. 

A dr visit here is about 40-50 euros which is the same as my coepay was in America 5 years ago when I left. 

Getting the IUD inserted in a privet hospital here in Greece 400€ that includes all cost and the IUD itself is free w my work insurance that is essentially the Greek tax payers insurance.",https://www.reddit.com/r/WomensHealth/comments/16mput6/i_did_not_realise_just_how_bad_american/,I did not realise just how bad American Healthcare is to women until I got an IUD in Greece - a rant,Support/Personal Experience ,961,162,0.99,CoffeeAndCats2000
i84wfp,Periods,1597196909.0,,https://i.redd.it/or3t72xw8hg51.jpg,Yuck,Fluff,937,58,0.99,CatDictator1
eeu6k2,Healthyhooha,1577151731.0,,https://i.redd.it/b6oysuebkh641.jpg,Thoughts?,,938,210,0.97,jessica_pin
19ehnko,Healthyhooha,1706104588.0,"Hello, this is my first post with this account, I actually created a burner just for this. I am 18 years old, since I was probably 13 I've had chronic, PERMANENT yeast infections and it's driving me insane. It started as Bacterial Vaginosis and that has since cleared up, but the yeast infection has remained. I have tried every treatment under the sun. Antifungals, boric acid, apple cider vinegar, over the counter creams, prescription drugs, birth control, everything. I legitimately do not know what to do anymore, I am a virgin and the idea that this yeast infection never going away and destroying my chances of a sex life bothers me so much. I am willing to do pretty much anything and take any tests. If anyone has any tips on tests to request from my gynecologist, pills to request, ANYTHING, please let me know. I don't want to sound dramatic but this is driving me up the wall",https://www.reddit.com/r/Healthyhooha/comments/19ehnko/this_permanent_yeast_infection_is_driving_me/,This permanent yeast infection is driving me insane,Advice Needed ,924,76,1.0,Beginning-Run-7839
md40lz,Periods,1616694430.0,,https://i.redd.it/rp8jiw72p7p61.jpg,For all of you on your periods here is someone mansplaining periods to you that makes sense Be happy,Fluff,920,45,0.98,Hellooldfriend179
