post_id,subreddit,created_utc,selftext,post_url,post_title,link_flair_text,score,num_comments,upvote_ratio,post_author
vktdws,WomensHealth,1656206791.0,"A Woman's Right to Die

A young girl cries on a cold stone floor. She shivers and seizes as the blood pools around her skirts. Her mother will find her next to a cup of pennyroyal. She is buried in the village churchyard under a shroud of shame. A young boy attends the funeral and sheds a single tear, then turns to find comfort in the arms of another girl.

A woman in her forties walks down dark stairs to a darker basement. She hopes this won’t take long; she has three children at home, waiting for their dinner. She learned of this place from a friend of a friend. Whispered under the roar of machines meant to break their backs and their will. Waiting for her is a cold metal table and a cold hearted man telling her to lie down. She will not make it home for dinner.

A new woman, nineteen, and on her own for the first time. There’s a party tonight, and she wants to look her best. The music is loud and the house is crowded. She doesn’t care that it smells like stale beer and sweat. There is a cute boy in the corner who offers her a drink. She thinks he’s nice and takes it from him. The next morning she doesn’t remember the boy, doesn’t know why she is waking up on a strange floor, why she smells of stale beer and sweat. Three weeks later she takes a test. It is not the kind you can study for but still she gets a positive result. She tries to tell someone. They ask her: What were you wearing? Were you drunk? She can’t remember. Is this her fault, she asks herself. She asks the doctor. He says yes. You must live with the consequences. Consequences. The word echoes through her body as she drags the knife across her flesh.

A woman, newly married, full of promise, lays in a hospital bed. She caresses the swell of her stomach, whispers loving words. The doctors enter, frowns on their faces, and she feels the dread begin to rise. They use big words that she has read in books, in the sections she tries to avoid. Her husband’s knuckles whiten against the bed rail. Options, they ask together. One doctor shakes his head. Her daughter will grow up without her mother.

Twelve faces judge a woman wearing orange. It doesn’t matter her age. They call her a murderer. They call her a whore. They say she had no right. The judge and the law agree. Her tears mean nothing. She should have thought of this before. When, she asks herself, was she supposed to think about the rest of her life? At the doctor’s office? On the drive out of state? When her lover said he didn’t care? Or when they laid down together as they had so many times before? When she chose a pill over a copper device? When she first met him, or the other hims before, from the very first? When? She has her whole life to find the answer.

A woman has always had the right to die. When will we get the choice to live?",https://www.reddit.com/r/WomensHealth/comments/vktdws/a_womans_right_to_die/,A woman’s right to die,,550,60,0.97,LilaTheBard
iwhste,Periods,1600621905.0,"I (14) figured out how to use a tampon. At first I messed up a bunch of times and it hurt a lot but once I got it right I was fine and it wasn't uncomfortable at all!

I know you probably don't care but I'm proud of myself and wanted to share with someone ❤",https://www.reddit.com/r/Periods/comments/iwhste/i_figured_out_how_to_use_a_tampon/,I FIGURED OUT HOW TO USE A TAMPON!!!!,Fluff,550,92,1.0,mockingjaygalaxy06
t05b0e,Healthyhooha,1645688806.0,Yeah :),https://www.reddit.com/r/Healthyhooha/comments/t05b0e/asked_him_to_wash_his_hands_before_fingering_me/,Asked him to wash his hands before fingering me and his response was “you’re being ridiculous”,,553,101,1.0,livelaughleo
js8ho4,Periods,1605102782.0,"October, 28th, 2020

Dear Seemingly Uneducated School Board,

Unfortunately the problem that female anatomy is an inconvenience to you and is not important enough to miss school has been brought to attention, so here are some scenarios that may help you understand why some girls don’t want to go to school during “that time of the month”. Imagine that for one week straight every month of the year blood *oozes* out of one of the most sensitive parts in your body, it sounds annoying right? Now on top of that imagine that as the blood *oozes* out you have uncontrollable emotional outbursts. Then, add on the pain of a neverending muscle cramp. Now for that entire week of blood, unexplainable emotions, and the never ending cramp inside your stomach whose pain is equal to a heart attack, not going to school is not an option because letting a child stay home for more than ten unexcused absences is illegal. 

A girl usually has her period once a month for seven days making that sixty-three days a school year that a girl is on her period and only **ten** of those she can stay home. So for sixty-three days you go to school miserable and in pain because you would rather the school didn’t call social services on your parents *just* because you were experiencing menstruation. Not all girls will even need more than one day at home, but those “one days” add up.

Every woman's period is different. Some have a blood flow so heavy that they resort to wearing all black along with having a tampon up, a pad down, and wearing their ugliest pair of underwear just in case they get ruined. Others may just be fine wearing a panty liner. Some have pain, some have none, and some have serious medical conditions that make cramps so bad they can barely walk. So whoever it was (male or female) that came out and said, “hey, it really doesn’t hurt that bad, girls don’t need to stay home for this” can shove it right up their ass unless they have experienced every girl's pain. 

I am writing this letter because, believe it or not, **I am a female**. I remember having my first period. It was in the middle of a volleyball game when I squatted down and all of the sudden a gush of hot, sticky blood soaked right into my spandex. I spent the night crying of embarrassment and in pain, but I would still have to show up to school the next day. 

Lucky for me, I got to spend my day in the ER because I experienced a very common side effect of menstruation: An **ovarian cyst**. 

A cyst is a little pouch sitting on your ovary that fills with liquid causing pain or discomfort. A ruptured cyst is explained to be more painful than appendicitis and child labor. According to Sergio Vignali, who is an OB/Gyn physician, “most women develop at least one cyst every month”. Some females don’t even realize they have them and their cysts go away with their period. It depends on the female if the cyst will burst or not, but unfortunately I developed four cysts that burst all in the same day. So, go back to where you're pretending that you're oozing blood, crying, and cramping, and now add on a ticking time bomb sitting on your ovary that may or may not go off any given moment.

  Do *you* still want to go to school?

Now that you have a very *small* understanding of females go through during “that time of the month,” hopefully you will reconsider your attendance protocols because no, parents aren't committing truancy by letting their daughter stay home. They are taking care of their child's physical and emotional needs. So, until you put a woman's anatomy inside you and feel what they feel, **don’t** minimize their pain, just let them have the damn day off.

Sincerely,

Liv",https://www.reddit.com/r/Periods/comments/js8ho4/schools_should_allow_periods_as_a_reason_for/,Schools Should Allow Periods As A Reason For Absences,Rants n Raves,551,117,0.97,liv_moham
i2l29s,Healthyhooha,1596406971.0,,https://i.redd.it/kwna6p010oe51.jpg,There’s this basic assumption among men that the only reason women get BV is because they’re having lots of unprotected sex with strangers. Some virgins struggle with chronic BV/yeast infections. I guess I’m looking for other women to be angry with me.,,542,77,0.99,None
j1pour,Periods,1601343499.0,,https://i.redd.it/80jdzvzuqzp51.jpg,When you’re trying to figure out if it’s a blood clot or a poop,Fluff,541,10,0.97,Snowflake0804
g36lad,WomensHealth,1587144979.0,"Today I found out what the real role of a hymen is. I was listening to [this podcast](https://www.bbc.co.uk/sounds/play/w3cszj31) on BBC sounds where two gynecologists were discussing issues related to women's reproductive systems, common myths, and harmful practices. Dr. Jen Gunter was asked about the hymen, and this is an excerpt from her response: 

*""The hymen exists to protect the infant vagina from urine and feces and dirt. Because right when you’re born, the vagina doesn’t have any estrogen and is incredibly vulnerable to irritants. As we start to walk and become continent of urine and feces, the hymen becomes pliable and takes on different shapes because we don’t need it anymore. So the hymen is the exact equivalent of baby teeth. It’s something that we needed developmentally for a small period of time, and then it’s discarded when we don’t need it anymore. It’s got different kinds of shapes and pliability, it’s in no way a reflection of virginity. That’s a social construct which is very harmful to women.""* 

I'm sharing this because it was the first time I had ever seen the explanation of the role of a hymen. Until now, I did not know what the role of a hymen was, I just thought it's just the tissue that exists. I knew it was unrelated to virginity, but I didn't know what it did, which I think is quite telling of the education we receive about the female reproductive system. I just wanted to share this information because I believe that it is very empowering to know your body.",https://www.reddit.com/r/WomensHealth/comments/g36lad/psa_the_actual_role_of_a_hymen/,PSA: The actual role of a hymen,,539,44,1.0,Zanbakh
j4d0hu,Periods,1601717848.0,,https://i.redd.it/xnxst0lznuq51.png,"When I smile through the pain, some tears escape the sides of my eyes ⚡🔥🦂🔪",Rants n Raves,541,6,0.99,None
feyghn,Periods,1583602845.0,,https://i.redd.it/t461dpbqeal41.jpg,I Got My Period So I’M Treating Myself To This Fancy AF Milkshake,Fluff,542,29,0.99,CerealTendencies
dvehfd,Healthyhooha,1573585125.0,,https://i.redd.it/a8whfpuyyay31.jpg,Cross section of a clitoral body.,,542,29,1.0,jessicaannpin
d3a8b5,Periods,1568304997.0,,https://i.redd.it/4p9fnwmfu6m31.jpg,It really be like this though...,Fluff,538,18,1.0,CondescendingTwat7
8fr81f,Healthyhooha,1525007178.0,"This is probably one of the most embarrassing things that's happened to me. But what better place to share it than here? Hopefully it serves as a cautionary tale to other vagina owners...

This happened two weeks ago.

It was a Thursday afternoon at work and my coworkers and I started to get a whiff of something... unsavory. This is not unusual because I work in the cancer center of a large hospital. As with any patient care role, you encounter a lot of smells that you didn't know even existed. And they can be bad.

This one was bad.

We wondered at first if it was a dead mouse, checking under desks and counters, or maybe the red biohazard bag hadn't been changed. We emptied all the trash cans and still the smell remained. It would come in wafts and seemed to follow us wherever we went.

That's when the usual ""oh God is it me?!"" fear kicked in. We smelled each other and checked our shoes but couldn't pinpoint the stench.

Around lunchtime I went to the employee lounge on the other side of the department, sat down, and had the sinking realization that that smell was definitely coming from me. Something was seriously wrong with my pussy and other people could *fucking smell it oh my god.*

I ran to the bathroom, dropped trou, and bent over to inspect my underwear. I had just finished my period a few days prior, so there was some brownish discharge, but that wasn't unusual. It did smell a little but it wasn't overpowering in that moment. I googled it (obviously) and found some info online about how sometimes discharge can be smelly at the end of your period. And mine have changed somewhat over the last year since I got an IUD so maybe that was it?

I anxiously completed the work day, my legs squeezed together whenever possible, and continued to help my coworkers search for a dead rat.

The worst moment was that at one point I moved my leg or something and a wave of the stink rose up like the Dark Mark. My coworker who was sitting by me actually stood up and moved. I wanted to die.

Friday went similarly except the smell was even worse. I was hoping it would magically disappear but no dice. Embarrassingly enough I actually threw away my underwear around 1pm (I had brought an extra) because the dried discharge smelled like actual death. I began to wonder if there was something going on here.

I made an appointment with planned parenthood for Monday evening and hoped it wasn't anything worse than a standard case of BV or something.

Over the weekend I warned my boyfriend of the chemical hazard brewing but we had sex anyways because we are trash. It was a horrible horrible decision ladies and gents. Afterwards his penis smelled god awful and my vagina felt like it was on fire. He gently assured me it was fine and didn't smell that bad but honestly the whole room reeked.

Monday I came equipped to work with a pack of pantyliners that I changed out every 45 minutes or so. The vagina goddesses were smiling upon me that day because this method worked and there was no noticeable smell that day.

Finally at long last I made it to my appointment and was anxiously waiting bare-bottomed under a paper sheet. The nurse had agreed that it seemed like a case of BV and some antibiotics would clear it right up.

The doctor came in and had me assume the position as we chatted about my symptoms. She was still talking as she inserted the speculum and stated to examine me but then stopped mid-sentence.

Slowly she closed her eyes, leaned back, and said ""Joyce, get the bag.""

I was thinking get the bag, GET THE BAG? FOR?!

And in that moment, she extracted the most disgusting tampon in the world from its horrible chamber. It's smell was instant and overpowering. I swear I heard it scream out as she tossed it in the biohazard bag.

I. Was. Mortified.

It must've been in there a week!! How could I forget a tampon?! How did my boyfriend not notice it?!

The doctor insisted it was actually pretty common and not to be embarrassed but holy shit.

So yeah next month I'm switching to a diva cup.",https://www.reddit.com/r/Healthyhooha/comments/8fr81f/a_recent_tale_of_unhealthy_hooha/,A recent tale of unhealthy hooha :(,,540,40,0.99,sessytime
v2ogio,Periods,1654109870.0,,https://i.redd.it/mnne9u0d42391.jpg,Organizing my bathroom today so I made a Menstruation Station!,Fluff,534,40,0.99,Ill_Butterscotch_337
xy748z,Periods,1665168920.0,,https://i.redd.it/jyug6dqlkfs91.jpg,Me rn,Fluff,530,6,1.0,cynefin99
pldl8n,Healthyhooha,1631246438.0,"So a few days ago I posted on this sub about how I received a call from my gynecologist that I tested positive for Chlamydia. I ended up deleting the post because everyone was stating that my fiancé was obviously cheating on me & that I got the STD from him. We’ve been together 8.5 years & are excitedly planning our wedding. Obviously these test results devastated me & I couldn’t believe he would betray me. He swore up & down that he never cheated on me & I honestly believed him. I didn’t want to sound naive, but I did not understand how it was physically possible for me to have Chlamydia. So I got swabbed again at the gynecologist & at my primary physician. My primary physician drew some lab work as well. I got a call today from the gynecologist that my first swab was a false positive & that my second swab came back clear. I looked EVERYWHERE online to see if there was any possible way my results could be false. Only 3% of all STD swab tests have a false positive. I am so relieved & feel bad for accusing my fiancé of cheating…He was pretty upset with me because he thought that I was also cheating. This experience was traumatic & the nurse that gave me the first phone call made me feel dumb. I asked if there was some sort of mix up or if the test could have been a false positive. She told me “no absolutely not.” So I requested for a second swab & she seemed very annoyed. This week was rocky for my fiancé & I but I’m happy we did not make any drastic decisions on our relationship.",https://www.reddit.com/r/Healthyhooha/comments/pldl8n/im_part_of_the_3/,I’m part of the 3%,Rant 🤬,534,34,1.0,VieleAud
11zcysi,Healthyhooha,1679557801.0,"Fuck yeast infections. Fuck the itching. Fuck the discharge. Fuck the meds I need to buy with my own money.

Fuck everything that causes or increases the chance of yeast infections. Fuck lube. Fuck condoms. Fuck fingering. Fuck PIV. Fuck sugary food. Fuck tampons. Fuck non-reusable pads. Fuck my copper IUD.

Fuck the fact that my copper IUD is the only birth control that doesn't mentally drain me but as a trade-off causes yeast infections. Fuck that *women* are the ones who have to carry the burden of birth control. Fuck all the fucking side effects of birth control.

(I do love my copper IUD ball compared to other birth control I've tried, but man I didn't know I was signing up for yeast infections at least once every half year.)",https://www.reddit.com/r/Healthyhooha/comments/11zcysi/fuck_yeast_infections/,Fuck yeast infections.,Rant 🤬,529,89,1.0,None
jkclw4,Periods,1603986840.0,,https://i.redd.it/4d2z1pdv22w51.png,Meme,Fluff,523,3,0.99,littlegiscool
ho5q42,Periods,1594310695.0,,https://i.redd.it/ks5keo1kuu951.jpg,"""Don’t mind me. I’m just laying on the couch with my heating pad trying not to burn down my house.""",Fluff,533,18,1.0,Zenstant
gdvcf1,Periods,1588674683.0,,https://i.redd.it/yeuemxuybxw41.jpg,"Been up all night in pain, this one got a good chuckle from me.",Sex,526,7,0.99,kittycaviar
105ui3s,Periods,1673112641.0,And that's on period #periodpositivity,https://i.redd.it/xqrb5tyv6paa1.jpg,Menstrual health = wealth 🩸💵,Health,529,52,1.0,KekeKurves
mia0m1,Periods,1617327139.0,,https://i.redd.it/xpk5656fynq61.jpg,it’s like that tho 🤷🏻‍♀️,Fluff,523,8,0.99,KitKat1287
o1dz3x,Healthyhooha,1623873675.0,"Hello from Vegas! I wanted to make a little update post because we finally have an answer and there's a lot that's happened since I made the original post.

If you recall, I had a very painful weeping ulcer on my vulva, along with some pelvic pain. I later noticed some yellow discharge. Everyone thought it was a Bartholin's Cyst until the gyno got a look at it and said he didn't know what it was but he wanted to test for herpes, the lab fucked up and tested it for covid, I was freaking out because the spot was healing and I didn't think I could get it retested.

So where are we now?

Well, about a day after I made the post, I requested a full panel of STI tests (including an HSV blood test, but my doctor said no to that one because of how unreliable they are). I spent a day out and about, and then woke up the next day in incredible pain. The spot was back and it was PISSED. I immediately requested to be seen again, somewhat hopeful that they could give the swab test another go. I saw a different (and, honestly nicer) gyno who swabbed me but also ordered the HSV blood test to corroborate the results. I got the blood drawn for some STI tests, and tried to get myself to pee in a cup for the rest of them. I am very bad at peeing on command so I ended up having to give up and go back TWICE to get anything to come out.

So, it's Monday morning, and my family and I are leaving for a little Vegas Father's Day trip in the afternoon. I am FINALLY able to pee in the cup to finish off all of the tests and as we head to Vegas, test results start coming in.

HIV? Negative
HepB? Negative
Syphilis? Negative
HSV-1 and HSV-2? Both negative from the swab (thank God)

Then, while sitting poolside I get a final notification, this one from the pee test, and announce probably too excitedly

""I HAVE CHLAMYDIA!""

So, here I am now, waiting to get my azithromycin prescription sent over to the CVS and getting another set up for my girlfriend, and through a few sitz baths the spot has healed up for real this time.

Thanks to everyone who gave me kind words and advice. Yall are the sweetest.",https://www.reddit.com/r/Healthyhooha/comments/o1dz3x/update_the_lab_accidentally_tested_my_vagina_for/,"UPDATE: ""The lab accidentally tested my vagina for covid instead of herpes""",Sexual Health 🚺,521,39,1.0,livierose17
onij8v,Periods,1626714910.0,,https://i.redd.it/56ohqrb3d7c71.jpg,Every time…,Rants n Raves,514,13,1.0,beetjuice88
k7mmv0,Periods,1607227720.0,,https://i.redd.it/n024899krh361.jpg,haha i still remember my first 2 years of periods,Rants n Raves,518,8,1.0,island_kissed228
e0l5v4,Periods,1574530874.0,,https://i.redd.it/weoqpgd53h041.jpg,When you get that poop cramp on top of your period cramps,Rants n Raves,518,11,1.0,throwawaytonsilsayy
pxz63s,Periods,1632933285.0,,https://i.redd.it/oenlnqtfzgq71.jpg,My friend got her first period today and I bought these for her :) I can’t wait to give them to her tomorrow!!!,Products,517,49,0.99,Orange_Hedgie
k6cuug,Periods,1607052440.0,,https://i.redd.it/8yq65swea3361.jpg,EVERY SINGLE TIME!!,Rants n Raves,510,16,1.0,island_kissed228
hzsm54,Periods,1595990566.0,,https://i.redd.it/mnit7udulpd51.jpg,Me when PMSing...,PMS,516,14,0.99,Charmander3141
kmmja1,Periods,1609274664.0,,https://i.redd.it/jqh09o9au6861.jpg,"Some women have discharge frequently or in certain periods, some women have it every day. It’s usually clear and milky and has a subtle smell, that doesn’t smell unpleasant. Discharge, the amount and even texture changes over the course of a women’s mentrual cycle.",Health,516,70,0.99,planetprudence
gjsed3,Periods,1589482108.0,,https://i.redd.it/sr7w9hlt0sy41.jpg,Making memes is the only thing getting me through this tbh,Fluff,509,4,1.0,None
gc1vqt,Periods,1588401397.0,,https://i.redd.it/ukovt4lcraw41.jpg,Oof,,510,15,0.99,kuffy123
yk4l28,Healthyhooha,1667393884.0,"I've noticed a couple of men (not doctors) subbed and commenting on multiple women's health subs, imcluding this one (exclusively, that's their entire acct history), even commenting on NSFW posts/photos from minors. One attempted to dismiss an OP's desire for a non-male OB due to trauma. This is just a reminder to stay vigilant and check post history before accepting advice.",https://www.reddit.com/r/Healthyhooha/comments/yk4l28/cis_men_in_womens_health_subs/,Cis men in women's health subs,,507,54,0.98,krustomer
