post_id,subreddit,created_utc,selftext,post_url,post_title,link_flair_text,score,num_comments,upvote_ratio,post_author
15ak0u8,Healthyhooha,1690410755.0,"For just about as long as I’ve been sexually active (about 10 years) I’ve experienced this painful papercut-like tear everytime I’ve had penetrative sex of any kind.

It would happen right at the base of the vaginal opening (perineal area) leading to a stinging burning sensation that would bleed just a litttttlleeeeee bit. Obviously super uncomfortable and distracting. 

It didn’t really occur to me that this shouldn’t really be happening, I just figured it was normal for the longest time. 

When I told my current partner of 7 years she felt so bad because she had no idea that it was happening and felt horrible. That was probably like 2-3 years ago. So we’d try different positions, lubes, toys, fingers, take even longer for foreplay, etc. nothing helped. To be clear too, it’s not the actual deep penetration that hurts, it’s just at the entrance.

After about a year of trying different things I finally canned up and talked to a doctor. I explicitly mentioned to her that arousal and lubrication was not an issue. I told her that I did not need any information on these but needed information on anything else that could be causing that. She sounded like she was listening, but after my appointment she wrote me a prescription for birth control and sent me lists of lubes to use and podcasts on arousal. 

I was so upset y’all, I cried. And then I had to pay the $80 copay. It was so frustrating.

I ended up taking a few more months to reach out to another doctor and put my foot down. I asked the nurse to order me a full STI, BV, UTI, and yeast panel. I went in last week and had all the tests done. This doctor was a lot more patient and took a solid 30 minutes with me instead of the last doctor. 

She mentioned it possibly being HPV a first guess, but otherwise “chronic inflammation and irritation.” She asked if I wear tight clothes/thongs often. I don’t really wear tight clothes but I do wear thongs daily unless I’m on my period. She suggested I switch to something more comfortable and go commando when possible. 

A few days later all tests came back negative but I kept up with her other suggestions.

Y’all. I waited like 4 days and my partner and I had sex after making these changes and almost all the pain was gone. It was so nice to have sex without the pain again. I used to tense up so much, worried, and I could never relax.

I’m so happy I found a solution, but frustrated it took me this long. I was browsing other subreddits with other people posting this issue with no resolution, so I wanted to also post in case anyone else had this issue.

TL:DR, don’t wear thongs",https://www.reddit.com/r/Healthyhooha/comments/15ak0u8/it_was_thongs_thats_it/,It was thongs. Thats it.,Sexual Health ,634,163,0.98,themaddhatt
lasn1t,Periods,1612261494.0,,https://i.redd.it/3x1xlavnj1f61.jpg,This doesn’t embarrass me as much as it used to thankfully (OC),Fluff,629,39,1.0,Doodley-Squat-Comics
q3hp2d,WomensHealth,1633637945.0,"17 years ago, my clitoris was damaged in a clitoral hood reduction performed without my consent. Afterwards, I was told it was all in my head. 

In the years since, I have fought for detailed anatomy of the clitoris, especially the course of its nerves, to be included in medical textbooks and curricula. 

I got the nerves in the clitoris into OB/GYN literature for the first time, I’ve gotten over 20 textbooks to agree to updates, and published a study. 

The Daily Show interviewed me and even had an actress play me to tell my story. 🥲

It would mean the world to me if you all could watch and help spread awareness about this continued gap in education. 

It’s called “Clitoral Anatomy: The Unstudied Frontier.”",https://www.reddit.com/r/WomensHealth/comments/q3hp2d/my_clitoris_advocacy_story_got_on_the_daily_show/,My clitoris advocacy story got on The Daily Show,,617,45,1.0,jessica_pin
1745f0w,Healthyhooha,1696891580.0,"Why do so many shows and comedians make jokes about smelly vaginas? Who are these jokes for, just men, or do women also think they're funny? I feel like they're punching down, and they're unfair since only about 50% of the world is affected. And no woman can actually stand up against the jokes because people will just say, why are you offended, does your vagina smell?

I keep starting new tv shows thinking the topic won't come up but it so often does! Unless I watch a kid friendly comedy series, it's always just a matter of time before someone makes a joke about vaginas. Is it because we think women with them are unhygienic, or too sexual, and therefore merit the joke as punishment? The jokes just feel really shitty because it's very out of your control. So many women get recurring bv and it's not necessarily even due to sexual reasons - they can be caused by antibiotics taken for other reasons. Mine started in childhood, I'm guessing it was due to antibiotics or something else out of my control! But even if it's caused by sex, it's not a women's fault if they try treatment but end up with recurring BV. Recurring BV is not well understand by science and that's no one's fault.

I'm just so sick of being the butt of jokes that cause a lot of shame. And watching TV shows that are fun for everyone else unaffected. I try to shake it off but it really does ruin the show for me.",https://www.reddit.com/r/Healthyhooha/comments/1745f0w/why_are_jokes_about_women_having_smelly_vaginas/,Why are jokes about women having smelly vaginas so popular in tv shows?,,616,84,0.97,Fit_Map_3995
m6y0b3,Periods,1615979377.0,,https://i.redd.it/g21x146umkn61.jpg,Fitness is my passion,Discussion,617,30,1.0,LoverofGrowth
kwfhxp,Periods,1610541021.0,,https://i.redd.it/46q35jetf3b61.jpg,👍,Period Question,610,20,1.0,Grilled_Cheezy
14bfkre,Healthyhooha,1686970742.0,"First Reddit post in a while and like my third ever. Seeking help as it’s late at night during a weekend and can’t see a doctor til Monday most likely. Sorry if this is TMI. PICS ATTACHED. 

I was using the bathroom and when I wiped, I saw a black dot on the paper. Found it weird, wiped again and there’s was another. I then reach down there and touch with my hand and find even more! I quickly wash myself with water from the sink til there’s no more. 

But something told me “check inside”. So I digged inside (after washing my hands) and THERE WAS SO MUCH MORE. It was mixed with white, odorless discharge (as pictured in comments). This is where I really start freaking out because WHAT THE HELL IS THIS?! And when I squished them with my fingers, there was like a black powder or paste that came out of them (as pictured in comments). 

Like I said, I definitely plan to go to the OBGYN on Monday but I wanted to see if anyone else has experienced or even heard of this before because no one I know has and I’m freaking out !!!

Thanks in advance.


UPDATE: Hello everyone. I’m super late (sorry!) but here’s my update.

1) I definitely wasn’t trolling!! Didn’t even know that was a thing on here, especially on the type of communities I posted on (women’s health). I really was just freaking out on a random night where I couldn’t see my Obgyn for a few days and ran to the internet for advice. 

2) Since I’m not an avid Reddit user, seeing all the comments I got (some negative, some positive) gave me SO much anxiety and I just deleted the app lol. I just signed back into my account recently and remembered this so thought I’d update!

3) Here’s the story: I did go to the emergency room even though I was hesitant just because I wanted whatever was in there to still have some trace that it was in there and waiting til Monday wasn’t going to guarantee that. 

IT ENDED UP BEING BORIC ACID. A couple days prior to this, I had sex and afterwards smelled a light smell so I decided to pop in a boric acid suppository overnight. For those that don’t know, the suppository just dissolves on its own and you don’t think about it again. Turns out that this suppository just .. didn’t dissolve completely? It just stayed there for a couple days and since the vagina is self-cleaning, it started pushing out the contents and that’s when I first saw it when wiping. No one in the ER could tell me why they turned black but they reassured me I wasn’t dying and that I was going to be okay so I was good with that!! Scary and embarrassing experience but I am glad I went and got it checked out sooner rather than later. 

Also just wanna say thanks to everyone who was nice, caring, and helpful. For the one who doubted that it was real: I get it. 
",https://www.reddit.com/r/Healthyhooha/comments/14bfkre/tiny_black_balls_inside_of_vagina/,TINY BLACK BALLS INSIDE OF VAGINA?!?!,Advice Needed ,607,626,0.95,GoddessYis
yvvrge,Periods,1668515296.0,,https://i.redd.it/ielq3eolg50a1.jpg,I'm scottish and our government are giving away period products to anyone. mine arrived last week!,Products,601,57,1.0,Successful-Basil2174
j87b4n,Healthyhooha,1602277389.0,,http://www.labialibrary.org.au/photo-gallery/#,Vulvas come in all different shapes and sizes! :),Sexual Health 🚺,601,33,0.99,laffiesaffie
d3z98e,Periods,1568427023.0,,https://i.redd.it/q8nghuk6xgm31.jpg,Bruh,,600,9,1.0,None
gw4luv,Healthyhooha,1591224326.0,"Hello r/Healthyhooha community, 

As I'm sure we are all aware, the United States is in turmoil over the recent deaths of George Floyd, Breonna Taylor, Ahmaud Arbery, and countless others who may be less renowned, but are no less important. The moderator team would like to express our support and solidarity with the BIPOC community, specifically those of you who are members of our community.

It has come to our attention that Reddit's lack of action against racism and hate speech sitewide is problematic. Several major subreddits are temporarily closing new posts tonight to protest Reddit's problematic response. Due to the nature of the content on this subreddit and the importance of ensuring our community has uninterrupted access to critical health information, /r/HealthyHooha will remain open to new posts and comment activity. 

Since we have opted out of joining the closures, even temporarily, we wanted to show our support by sharing some important resources for our BIPOC community, including links to BLM resources, information on health disparities, the Midwives of Color Initiative, and various other important articles on the topic in the comments below. *Credit to /u/peachikeene for crafting this message and identifying these resources.*


We stand in solidarity with you. **Black Lives Matter.**",https://www.reddit.com/r/Healthyhooha/comments/gw4luv/we_stand_with_you_blacklivesmatter/,We Stand With You! #BlackLivesMatter, Community Updates,599,23,0.98,friedbunnies
fxx5w7,Periods,1586455082.0,,https://i.redd.it/g68fjqdyztr41.jpg,me aged 13 alone in the bathroom realizing my period is 4 days late,Am I Pregnant?,595,12,1.0,grapeflavoredorange
1c6rjfp,Healthyhooha,1713404906.0,"Has any one cured BV with vaginal probiotics only instead of metronidazole gel being that BV is an overgrowth of bacteria? (Crowd it out maybe) Going on a vacation in a few days and starting to feel symptoms and tested my ph, it’s about 4.7. I’m hoping not to have to deal with the mess of the gel while hiking etc . Thanks!",https://www.reddit.com/r/Healthyhooha/comments/1c6rjfp/bv_treatment_with_vaginal_probiotics_only/,BV treatment with vaginal probiotics only ?,,755,11,1.0,Healthy_Intention286
wu6bcc,Periods,1661105903.0,,https://i.redd.it/ntf0of36z3j91.jpg,Apologies for the low quality but my asshole is going through hell on earth right now.,Fluff,596,26,1.0,darkmattermattersmat
kb5rf6,Periods,1607703376.0,,https://i.redd.it/nmwre3d12l461.jpg,Let me just flex on yall,Fluff,592,42,0.98,None
hoy7oq,Periods,1594418583.0,,https://i.redd.it/65931w1hr3a51.jpg,The Period Starter Pack,Rants n Raves,585,46,0.99,None
k1876r,Periods,1606364401.0,,https://i.redd.it/yg0gaowkgi161.jpg,When your period arrives four days early and you haven't had a chance to go out and replenish your period snacks supply 😭,Fluff,588,16,1.0,Vanoice
mo47qq,Healthyhooha,1618059522.0,"Hi everybody,

I am a 23 year old female who has been suffering from an itchy vulva/butt for five and a half months. I’ve seen many suffer with that on this reddit so I wanna share my story and hopefully help in some way. 
I’ve always suffered with intermittent vulva itching but if I’m being honest, I kinda ignored it but last October it got really bad. I went to planned parenthood and they said I had a yeast infection, did an STD test and sent me on my way with antibiotics. The itching didnt go away. I returned to planned parenthood two more times, they gave me a steroid cream that did not help and continuously treated me for a yeast infection I did not have and did repetive STD tests. Eventually, they pretty much said they couldnt do anything. I then went to a gynochologist who gave me ANOTHER steroid, also tested me for STD’s and gave me more yeast pills. After two months of suffering I was over it and decided to go to a dermatologist. The first dermatologist was horribly rude, looked at me for literally 10 seconds and said it looked fine but gave me a steroid cream anyways. This cream gave me a terrible rash. I went to a second dermatologist who was male and clearly uncomfortable looking at my genitals. He looked at me for about 2 seconds and gave me an antifungal cream and more yeast pills lol. I was at my wits end. I could barely do anything, I couldnt work out so I was gaining weight, I couldnt have sex, and showering made things horribly worse. I finally decided to go to a third dermatologist who honestly saved me. She was the first dermatologist to use a dermascope on my vulva (the microscope that derms use), and also checked my butt, elbows, head and fingers with it. She looked at me and said “You so clearly have psoriosis on multiple parts of your body including your genitals. I am shocked nobody noticed this, I wish you had seen me 5 months ago”. I honestly burst into tears because it was so nice having someone actually take me seriously and not automatically assume I have a yeast infection or an STD. I explained psorious and autoimmune diseases run in my family and she figured out that one of my psychiatric medications can trigger psoriosis. She gave me a topical psoriosis cream and has told me to supplement with Vitamin D. I have already started to feel better and its only been a week. While “cured” isnt the right word for my issues because psoriosis is a long term condition, it can get better with certain medications and lifestyle changes. All I have to say is, please please please advocate for yourself. I let the doctors walk all over me for 5 months even though I knew there was something off. I hope this can help in anyway or at least give you hope that it is possible to get better.",https://www.reddit.com/r/Healthyhooha/comments/mo47qq/found_a_cure_for_my_itchy_vulva/,Found a cure for my itchy vulva!!, Community Updates,587,58,1.0,ps3226
rxdnqm,Healthyhooha,1641472777.0,"Why the fuck do people become gynecologists if they're gonna judge you for seeking treatment? Some of these doctors are borderline incompetent too, it's infuriating. (Context: I live in a very conservative country.)

So I (21F) have had issues with my thyroid for  almost three years now and I was unmedicated for a good chunk of that time which took a huge toll on my body. 

I guess because my hormones are all out of whack, I've been chronically dry down there with low libido and diminished physical sensation, and my bartholin's glands have been partially blocked for over a year because the fluid is too viscous.

Not exactly A-OK. So I visit a gynecologist. Did she prescribe medication or order further blood tests? Nope. 

She asked me ""why do you care so much about being dry if you're unmarried?"" Apparently it's not a problem worth treating if I'm not actively in pain, because I'm an unmarried woman. My body is not functioning as it should and I want it fixed, is that not a good enough reason? 

Awkward moment aside she decides to do a physical examination anyway. Apparently there's ""absolutely nothing wrong with me"" and ""how would you (21F, unmarried) even *know* you're too dry?"" Because only married people get wet and experience sexual arousal, apparently. Unmarried women are just oblivious to their vagina's existence until marriage, don't you know? 

I'm not having any of this, so I explain that I've previously had a blocked (painless) bartholin's gland which I developed after my thyroid issues started, hoping that might elicit some helpful advice. She told me it's because I have pubic hair which must mean I'm unhygienic. That's about when I gave up.

I'm not even surprised. This isn't even uncommon behavior among gynecologists here. I'm sick of begging doctors to do their job. Sorry if this is unrelatable, I just had to rant.",https://www.reddit.com/r/Healthyhooha/comments/rxdnqm/im_sick_of_conservative_gynecologists/,I'm sick of conservative gynecologists,Rant 🤬,579,72,0.99,Blue1013
l0euw8,Periods,1611041172.0,,https://i.redd.it/uyemyxm0r8c61.jpg,Just shut up and bring me chocolate (OC),Fluff,580,4,0.99,Doodley-Squat-Comics
fbper3,Periods,1583039693.0,,https://i.redd.it/zl0peuy8wzj41.jpg,This made me giggle because i'm suffering right now and i have heavy flow so i relate,Rants n Raves,578,9,1.0,ProjectC13
ruvcsf,Periods,1641192301.0,,https://i.redd.it/hf0qukrs5f981.jpg,My period tracker for 2022,Fluff,579,38,1.0,lostpatroness
nmaos8,Healthyhooha,1622131270.0,"I'm an OB/GYN with over 25 years of experience as a vulvar and vaginal diseases expert. I’m also an internationally bestselling author, and my New York Times and USA Today bestselling book, The Vagina Bible, has been translated into nineteen languages. The Cut called me “Twitter’s resident gynecologist” and The Guardian called me “the world’s most famous—and outspoken—gynecologist.” My TED Talk was one of 2020’s Top Ten, and I am the host of the new TED Collective Podcast Body Stuff with Dr. Jen Gunter. I’m also a contributor to The New York Times and the star of the CBC/Amazon Prime series Jensplaining. I hate medical misinformation and I am here to build a better medical Internet.

Thank you everyone for such great questions! I do have to go. 

Proof: 

https://i.redd.it/ixo55r82h3171.jpg",https://www.reddit.com/r/Healthyhooha/comments/nmaos8/im_dr_jen_gunter_obgyn_author_of_the_vagina_bible/,"I'm Dr. Jen Gunter, OB/GYN, author of The Vagina Bible and The Menopause Manifesto. I correct medical myths and misinformation about reproductive health. Ask Me Anything!",,573,166,0.99,DrJenGunter
nk3qdk,Periods,1621878368.0,,https://i.redd.it/c77xt0miv3171.jpg,It do be like that,Fluff,570,25,1.0,None
mlvldf,Periods,1617775308.0,,https://i.redd.it/n4y0uy72zor61.jpg,what it feels like,Fluff,567,15,1.0,KitKat1287
d2oehf,Periods,1568200122.0,,https://i.redd.it/386fny3l6yl31.jpg,If this ain’t true...,Fluff,563,14,0.99,risingsassysoul
xbo5l8,Periods,1662916828.0,,https://i.redd.it/1m4jjmazj9n91.jpg,I’d be running like Usain Bolt to get that pad on,Fluff,557,71,0.99,_satantha_
10dtx90,Healthyhooha,1673906726.0,"Sharing this wild story because I am still in disbelief that this actually happened. Last night I peed and noticed a long hair (from my head) hanging down and went to pull it thinking nothing of it. It wouldn’t budge. Panicked slightly because I have an IUD and thought it was the strings but nope, a long hair. I put a finger in my vagina and felt a weird lump on the side of my wall with the hair attached to it and had the horrible realization that it was somehow tangled up in there. Boyfriend felt around and agreed it felt concerning. I called the on call number for my gyn and they said I wouldn’t be able to be seen until Tuesday, otherwise I’d have to go to the ED. 

I went this morning and after a 5 hr wait, had a young male resident have a look and said it was wrapped around a piece of my vaginal tissue and cutting off the circulation. I should also mention that I work at this hospital so it’s especially mortifying that I had to go in for this. He looked at his attending and said there was no way he could get it but that the tissue was dark from circulation being cut off so they called OB. At this point I’m crying and freaking out.
OB came and they were super nice and felt confident they would get it out. After laying there with scissors and forceps in my vagina while hyperventilating and crying, the hair was unwound and removed. My guess is that the hair got in there when my boyfriend and I were having sex over the weekend and the in-out somehow wound it up in there. 

Truly crazy. The OB attending was an old guy who “thinks” he’s seen this before but otherwise it was a new one for everyone. Just adding this to my list of all the possible things to worry about when having sex now. The end.",https://www.reddit.com/r/Healthyhooha/comments/10dtx90/hair_tourniquet_in_vagina/,Hair tourniquet in vagina,,562,55,1.0,Throwawayhairscare
ky8d4r,Periods,1610758595.0,,https://i.redd.it/qp68fdfrelb61.jpg,Was inspired to make some before & after earrings,PMS,565,41,0.96,m_eats_drugs
imt02y,Periods,1599271355.0,,https://i.redd.it/nedpuubbl8l51.jpg,My first period meme regarding my horrible period ruining my whole damn day today.,Rants n Raves,561,10,1.0,NotRyanStilesWife
ibps6k,Periods,1597707745.0,"My boyfriend of about one month dropped off some snacks for me, as I told him I wasn’t feeling well on my period (so sweet). My mother then told me that I should not have mentioned that to him, especially early on in the relationship. When asked why, she gave no valid reason. My response was “what if I told him I had a stomachache instead? Would that have been okay?” No response. I’m tired of having to censor myself to fit “societal norms” which have changed throughout the years; I didn’t think period shaming still existed in such a blatant form anymore in the United States. Nothing I said could change her mind, even after mentioning that I can disclose what I want about my body, especially about something that happens to virtually all women. What’s stupid is that I find men don’t care when you talk about your period, but older women do. If you’ve read through this, fuck censoring yourself to make others feel comfortable. Call people out for their misogyny and sexism.",https://www.reddit.com/r/Periods/comments/ibps6k/period_shaming_needs_to_stop/,Period shaming needs to stop,Rants n Raves,554,37,0.99,stopshamingme
gi3962,Periods,1589254482.0,,https://i.redd.it/0ltacqa089y41.jpg,ç r ä m p ś,PMS,555,13,0.99,FluorescentIdiot
wzaoeh,Periods,1661626948.0,,https://i.redd.it/scnf8xch0bk91.jpg,Guess who got through their entire period without ruining their underwear for the first time?,Fluff,550,28,0.99,virgojoon
